{"$schema":"https://json-schema.org/draft/2020-12/schema","$id":"claim.schema.json","type":"object","additionalProperties":false,"required":["id","topicId","text","conceptIds"],"properties":{"id":{"type":"string","minLength":1,"maxLength":128},"topicId":{"type":"string","minLength":1,"maxLength":128},"text":{"type":"string","minLength":1,"maxLength":800},"stance":{"enum":["pro","con","neutral","mixed"]},"conceptIds":{"type":"array","items":{"type":"string","minLength":1,"maxLength":128},"uniqueItems":true,"maxItems":500}}}
