[
  {
    "id": "claim-candidate-0000-01",
    "topicId": "ai-agents-future-work",
    "text": "Economic forces such as adverse selection, moral hazard, and reputation will persist in future agentic labor markets due to the inherent presence of incomplete information.",
    "stance": "pro",
    "conceptIds": [
      "concept-31e55046b3ece7183b1f",
      "concept-d1a35d9aaaa341fa2cd6"
    ]
  },
  {
    "id": "claim-candidate-0000-02",
    "topicId": "ai-agents-future-work",
    "text": "Developing metacognitive and strategic reasoning as intrinsic model capabilities is identified as a more promising path for long-term agent success than relying solely on external scaffolding.",
    "stance": "pro",
    "conceptIds": [
      "concept-2059bc5318a907c9509d",
      "concept-4e40bea07635c9f1e056"
    ]
  },
  {
    "id": "claim-candidate-0001-01",
    "topicId": "ai-agents-future-work",
    "text": "UpBench seeks to ground AI benchmarks in real-world economic marketplace data to increase authenticity and economic relevance compared to synthetic datasets.",
    "stance": "neutral",
    "conceptIds": [
      "concept-3d119f7942924710c399",
      "concept-f0e5f53af7e637286fd5"
    ]
  },
  {
    "id": "claim-candidate-0001-02",
    "topicId": "ai-agents-future-work",
    "text": "The integration of human feedback allows for iterative refinement, with nearly one in five initially failed tasks being successfully rescued through human-guided intervention.",
    "stance": "pro",
    "conceptIds": [
      "concept-68e155f7aba2959df921",
      "concept-f0e5f53af7e637286fd5"
    ]
  },
  {
    "id": "claim-candidate-0002-01",
    "topicId": "ai-agents-future-work",
    "text": "The authors argue that agentic AI may expose complete workflows that task-level frameworks do not capture.",
    "stance": "neutral",
    "conceptIds": [
      "concept-f0e5f53af7e637286fd5",
      "concept-465dad65bdb4765b02d1"
    ]
  },
  {
    "id": "claim-candidate-0002-02",
    "topicId": "ai-agents-future-work",
    "text": "Model projections indicate 93.2% of 236 analyzed information-intensive occupations in the San Francisco Bay Area (Tier 1) will cross the moderate-risk displacement threshold by 2030.",
    "stance": "neutral",
    "conceptIds": [
      "concept-3acd44b3729532f42dcd"
    ]
  },
  {
    "id": "claim-candidate-0003-01",
    "topicId": "ai-agents-future-work",
    "text": "In comparative testing, single-model RAG baselines achieved higher median answer-correctness scores than the multi-agent system configuration.",
    "stance": "neutral",
    "conceptIds": [
      "concept-a1f9d63328074e333a90",
      "concept-9fd749528fd321690c30",
      "concept-1917e406080cd1b20da1"
    ]
  },
  {
    "id": "claim-candidate-0003-02",
    "topicId": "ai-agents-future-work",
    "text": "Multi-agent systems leveraging role-based collaboration offer a competitive alternative for legal question answering by approximating accuracy levels similar to traditional RAG.",
    "stance": "pro",
    "conceptIds": [
      "concept-a1f9d63328074e333a90",
      "concept-9fd749528fd321690c30"
    ]
  },
  {
    "id": "claim-candidate-0003-03",
    "topicId": "ai-agents-future-work",
    "text": "Automated metrics like BLEU have documented limitations in capturing legal interpretative nuances, making expert human evaluation necessary for validation.",
    "stance": "pro",
    "conceptIds": [
      "concept-9fd749528fd321690c30",
      "concept-709717bf391dc9aa093f"
    ]
  },
  {
    "id": "claim-candidate-0004-01",
    "topicId": "ai-agents-future-work",
    "text": "The elastic supply margin for cognitive labor has migrated from the labor market to the compute capital market, meaning compute prices are the primary wage-setter for automated tasks.",
    "stance": "pro",
    "conceptIds": [
      "concept-630ac89d626bf57f63d2",
      "concept-ed6cb899698cf6f77632"
    ]
  },
  {
    "id": "claim-candidate-0004-02",
    "topicId": "ai-agents-future-work",
    "text": "The CAW bound provides a theoretical mechanism suggesting human wages are constrained by compute-market conditions rather than infinite labor supply.",
    "stance": "pro",
    "conceptIds": [
      "concept-630ac89d626bf57f63d2",
      "concept-76b9286226b3d82e1b8d"
    ]
  },
  {
    "id": "claim-candidate-0004-03",
    "topicId": "ai-agents-future-work",
    "text": "The framework suggests a directional inversion of skill-biased technical change, where the wage outcome depends on the task's substitutability rather than traditional skill ladders.",
    "stance": "pro",
    "conceptIds": [
      "concept-465dad65bdb4765b02d1"
    ]
  },
  {
    "id": "claim-candidate-0006-01",
    "topicId": "ai-agents-future-work",
    "text": "The debate over AI's future impact on labor can be distilled into disputes over the pace of AI progress and the strength of AI-driven job creation.",
    "stance": "neutral",
    "conceptIds": [
      "concept-0edcc8fa21fb74861a49",
      "concept-63ed82e67d15308791e5"
    ]
  },
  {
    "id": "claim-candidate-0006-02",
    "topicId": "ai-agents-future-work",
    "text": "Policymakers should prioritize robust, scenario-agnostic strategies like improved data collection and the piloting of wage insurance and training programs to manage potential labor market shocks.",
    "stance": "neutral",
    "conceptIds": [
      "concept-6192b50f9648ef076745"
    ]
  },
  {
    "id": "claim-candidate-0007-01",
    "topicId": "ai-agents-future-work",
    "text": "By 2030, the most valuable employees will be those capable of supervising AI-driven workflows rather than those who simply provide prompts.",
    "stance": "pro",
    "conceptIds": [
      "concept-e748f8750672ca8b04b2",
      "concept-f83c5553308b06963bd0",
      "concept-18deff1e4c824148d3e1"
    ]
  },
  {
    "id": "claim-candidate-0007-02",
    "topicId": "ai-agents-future-work",
    "text": "AI agents are not autonomous employees; they require structured oversight within bounded, low-ambiguity workflows to be effective.",
    "stance": "pro",
    "conceptIds": [
      "concept-e748f8750672ca8b04b2",
      "concept-bc5d19a9da020918341c",
      "concept-efe77b201dc216c0edf4"
    ]
  },
  {
    "id": "claim-candidate-0007-03",
    "topicId": "ai-agents-future-work",
    "text": "The ResumeVera Team forecasts that while AI agents will absorb or accelerate certain tasks, the broader shift will involve the creation of new review and orchestration responsibilities.",
    "stance": "neutral",
    "conceptIds": [
      "concept-e748f8750672ca8b04b2",
      "concept-18deff1e4c824148d3e1"
    ]
  },
  {
    "id": "claim-candidate-0008-01",
    "topicId": "ai-agents-future-work",
    "text": "Occupations with higher observed AI exposure show a weak negative correlation with long-term BLS job growth projections.",
    "stance": "neutral",
    "conceptIds": [
      "concept-8c66673aed32f74d9b26",
      "concept-c7c88ca51e71153fb785"
    ]
  },
  {
    "id": "claim-candidate-0008-02",
    "topicId": "ai-agents-future-work",
    "text": "There is no systematic or detectable increase in unemployment for highly exposed workers, but there is suggestive, barely significant evidence of a hiring slowdown for young workers in these roles.",
    "stance": "neutral",
    "conceptIds": [
      "concept-0ab37c8e4a2ef4607964",
      "concept-70e00972fbb7f0c9bbfa",
      "concept-8c66673aed32f74d9b26"
    ]
  },
  {
    "id": "claim-candidate-0009-01",
    "topicId": "ai-agents-future-work",
    "text": "Current AI systems lack the intelligence, multimodal capabilities, computer-use proficiency, and continual learning required to function as reliable autonomous agents.",
    "stance": "neutral",
    "conceptIds": [
      "concept-e748f8750672ca8b04b2",
      "concept-84587ee022cf5d894321",
      "concept-51f01dfbe23241a1f41e"
    ]
  },
  {
    "id": "claim-candidate-0009-02",
    "topicId": "ai-agents-future-work",
    "text": "Andrej Karpathy estimates that it will take approximately a decade to address the current functional limitations of AI agents.",
    "stance": "neutral",
    "conceptIds": [
      "concept-e748f8750672ca8b04b2"
    ]
  },
  {
    "id": "claim-candidate-0009-03",
    "topicId": "ai-agents-future-work",
    "text": "The compounding probability of error in multi-step tasks significantly limits the reliability of current autonomous systems, as noted by ScaleAI lead Quintin Au.",
    "stance": "neutral",
    "conceptIds": [
      "concept-e748f8750672ca8b04b2"
    ]
  },
  {
    "id": "claim-candidate-0010-01",
    "topicId": "ai-agents-future-work",
    "text": "Agentic AI differs from Gen AI by autonomously planning, deciding, and executing tasks with minimal human input.",
    "stance": "neutral",
    "conceptIds": [
      "concept-f0e5f53af7e637286fd5"
    ]
  },
  {
    "id": "claim-candidate-0010-02",
    "topicId": "ai-agents-future-work",
    "text": "The Total Cost of Work (TCoW) approach is presented as a framework for companies to compare investments in digital and human labor on a like-to-like basis.",
    "stance": "neutral",
    "conceptIds": [
      "concept-3a8ea63d8ff98888af3a"
    ]
  },
  {
    "id": "claim-candidate-0011-01",
    "topicId": "ai-agents-future-work",
    "text": "Organizational factors, such as culture and management practices, accounted for more than twice the modeled importance (67% vs. 32%) in reported AI impact compared to individual factors.",
    "stance": "neutral",
    "conceptIds": [
      "concept-fd079361801e7827d27f",
      "concept-1df5ee1b1b2e88ebd038"
    ]
  },
  {
    "id": "claim-candidate-0011-02",
    "topicId": "ai-agents-future-work",
    "text": "Frontier Professionals are more likely than others to report intentionally performing some work without AI to maintain their own skill proficiency.",
    "stance": "pro",
    "conceptIds": [
      "concept-e406694b2fe8041d3c14"
    ]
  },
  {
    "id": "claim-candidate-0012-01",
    "topicId": "ai-agents-future-work",